[
  {
    "id": "cell_1",
    "name": "Cell 1",
    "type": "uint32",
    "podUnits": "uV",
    "displayUnits": "uV"
  },
  {
    "id": "cell_2",
    "name": "Cell 2",
    "type": "uint32",
    "podUnits": "uV",
    "displayUnits": "uV"
  },
  {
    "id": "cell_3",
    "name": "Cell 3",
    "type": "uint32",
    "podUnits": "uV",
    "displayUnits": "uV"
  },
  {
    "id": "cell_4",
    "name": "Cell 4",
    "type": "uint32",
    "podUnits": "uV",
    "displayUnits": "uV"
  },
  {
    "id": "cell_5",
    "name": "Cell 5",
    "type": "uint32",
    "podUnits": "uV",
    "displayUnits": "uV"
  },
  {
    "id": "cell_6",
    "name": "Cell 6",
    "type": "uint32",
    "podUnits": "uV",
    "displayUnits": "uV"
  },
  {
    "id": "voltage_min",
    "name": "Min Cell",
    "type": "uint32",
    "podUnits": "uV",
    "displayUnits": "uV"
  },
  {
    "id": "voltage_max",
    "name": "Max Cell",
    "type": "uint32",
    "podUnits": "uV",
    "displayUnits": "uV"
  },
  {
    "id": "total_voltage",
    "name": "Total Voltage",
    "type": "float32",
    "podUnits": "uV",
    "displayUnits": "uV"
  },
  {
    "id": "SOC",
    "name": "SOC",
    "type": "float32",
    "podUnits": "%",
    "displayUnits": "%"
  },
  {
    "id": "temperature_1",
    "name": "Temperature 1",
    "type": "float32",
    "podUnits": "ºC",
    "displayUnits": "ºC"
  },
  {
    "id": "current",
    "name": "Current",
    "type": "float32",
    "podUnits": "A",
    "displayUnits": "A"
  },
  {
    "id": "State",
    "name": "State",
    "type": "enum",
    "enumValues": [
      "CONNECTING",
      "OPERATIONAL",
      "FAULT"
    ]
  }
]